<?xml version="1.0" encoding="UTF-8"?>
<!-- generated: 2005-08-15T15:14:41-05:00 -->
<!-- generated by: voeckler [??] -->
<definitions xmlns="http://www.griphyn.org/chimera/VDL" xmlns:xsi="http://www.w3.org/2001/XMLSchema-instance" xsi:schemaLocation="http://www.griphyn.org/chimera/VDL http://www.griphyn.org/chimera/vdl-1.24.xsd">
  <transformation namespace="tut" name="echo">
    <declare name="file" link="output" container="scalar"/>
    <declare name="message" link="none" container="scalar"/>
    <argument>
      <use name="message"/>
    </argument>
    <argument name="stdout">
      <use name="file"/>
    </argument>
  </transformation>
  <derivation namespace="voeckler" name="hello" usesspace="tut" uses="echo">
    <pass bind="file">
      <scalar>
        <lfn file="voeckler.hw.txt" link="output" dontRegister="false" dontTransfer="false" optional="false"/>
      </scalar>
    </pass>
    <pass bind="message">
      <scalar>
        <text>Hello World</text>
      </scalar>
    </pass>
  </derivation>
</definitions>
